{
  "schemaVersion": 1,
  "workspaceRevision": "sha256:21ce7d7881bf4edf948d5afab57c81c941eb1743e1b99b5026cd7b441de7f1e2",
  "sourceId": "src/main.vib",
  "offset": 65,
  "nodeId": "src/main.vib#65-69",
  "structural": {
    "schemaVersion": 1,
    "offset": 65,
    "sourceId": "src/main.vib",
    "span": {
      "sourceId": "src/main.vib",
      "start": 65,
      "end": 69,
      "startPosition": {
        "line": 3,
        "column": 11
      },
      "endPosition": {
        "line": 3,
        "column": 15
      }
    },
    "mode": "source",
    "syntaxKind": "atom",
    "category": "expression",
    "status": "exact",
    "permittedForms": [
      "lambda",
      "do",
      "if",
      "match",
      "return",
      "as",
      "try"
    ],
    "permittedLabels": [
      "types"
    ]
  },
  "role": {
    "status": "exact",
    "value": "@literal"
  },
  "context": {
    "status": "exact",
    "value": "let-value"
  },
  "identity": {
    "status": "unavailable",
    "value": null
  },
  "expectedType": {
    "status": "unavailable",
    "value": null
  },
  "observedType": {
    "status": "exact",
    "value": {
      "kind": "primitive",
      "name": "i32",
      "parameters": [],
      "result": null,
      "labelled": []
    }
  },
  "visibleLocals": {
    "status": "exact",
    "value": [
      {
        "name": "flag",
        "identity": "binder:src/main.vib:14-18"
      },
      {
        "name": "value",
        "identity": "binder:src/main.vib:24-29"
      }
    ]
  },
  "visibleImports": {
    "status": "exact",
    "value": []
  },
  "declarationCandidates": {
    "status": "exact",
    "value": []
  },
  "application": {
    "status": "unavailable",
    "value": null
  },
  "pattern": {
    "status": "unavailable",
    "value": null
  }
}
