{
  "schemaVersion": 1,
  "workspaceRevision": "sha256:907ada83b5257fd4415831b9dc687fe48bd74847cb4ee3a5a2e53a8454458fab",
  "sourceId": "src/main.vib",
  "offset": 57,
  "nodeId": "src/main.vib#57-62",
  "structural": {
    "schemaVersion": 1,
    "offset": 57,
    "sourceId": "src/main.vib",
    "span": {
      "sourceId": "src/main.vib",
      "start": 57,
      "end": 62,
      "startPosition": {
        "line": 1,
        "column": 58
      },
      "endPosition": {
        "line": 1,
        "column": 63
      }
    },
    "mode": "source",
    "syntaxKind": "atom",
    "category": "expression",
    "status": "exact",
    "permittedForms": [
      "lambda",
      "do",
      "let",
      "if",
      "match",
      "as",
      "try"
    ],
    "permittedLabels": [
      "types"
    ]
  },
  "role": {
    "status": "exact",
    "value": "@local-binding"
  },
  "context": {
    "status": "exact",
    "value": "result"
  },
  "identity": {
    "status": "exact",
    "value": {
      "kind": "binder",
      "canonical": "binder:src/main.vib:13-18"
    }
  },
  "expectedType": {
    "status": "exact",
    "value": {
      "kind": "primitive",
      "name": "i32",
      "parameters": [],
      "result": null,
      "labelled": []
    }
  },
  "observedType": {
    "status": "exact",
    "value": {
      "kind": "primitive",
      "name": "i32",
      "parameters": [],
      "result": null,
      "labelled": []
    }
  },
  "visibleLocals": {
    "status": "exact",
    "value": [
      {
        "name": "first",
        "identity": "binder:src/main.vib:13-18"
      },
      {
        "name": "rest",
        "identity": "binder:src/main.vib:39-43"
      }
    ]
  },
  "visibleImports": {
    "status": "exact",
    "value": []
  },
  "declarationCandidates": {
    "status": "exact",
    "value": []
  },
  "application": {
    "status": "unavailable",
    "value": null
  },
  "pattern": {
    "status": "unavailable",
    "value": null
  }
}
