{
  "schemaVersion": 1,
  "workspaceRevision": "sha256:0823b1f4595160eee16a71baca17a7c21af27a6e824366066c5f4ab183c081ea",
  "sourceId": "src/main.vib",
  "offset": 84,
  "nodeId": "src/main.vib#84-85",
  "structural": {
    "schemaVersion": 1,
    "offset": 84,
    "sourceId": "src/main.vib",
    "span": {
      "sourceId": "src/main.vib",
      "start": 84,
      "end": 85,
      "startPosition": {
        "line": 3,
        "column": 21
      },
      "endPosition": {
        "line": 3,
        "column": 22
      }
    },
    "mode": "source",
    "syntaxKind": "open-paren",
    "category": "expression",
    "status": "exact",
    "permittedForms": [
      "lambda",
      "do",
      "let",
      "let-else",
      "if",
      "match",
      "return",
      "as",
      "try"
    ],
    "permittedLabels": [
      "types"
    ]
  },
  "role": {
    "status": "exact",
    "value": "@application"
  },
  "context": {
    "status": "exact",
    "value": "result"
  },
  "identity": {
    "status": "unavailable",
    "value": null
  },
  "expectedType": {
    "status": "exact",
    "value": {
      "kind": "primitive",
      "name": "i32",
      "parameters": [],
      "result": null,
      "labelled": []
    }
  },
  "observedType": {
    "status": "exact",
    "value": {
      "kind": "primitive",
      "name": "i32",
      "parameters": [],
      "result": null,
      "labelled": []
    }
  },
  "visibleLocals": {
    "status": "exact",
    "value": []
  },
  "visibleImports": {
    "status": "exact",
    "value": [
      {
        "alias": "helper",
        "module": "@app.helper",
        "sourceId": "src/main.vib",
        "span": {
          "sourceId": "src/main.vib",
          "start": 0,
          "end": 27,
          "startPosition": {
            "line": 1,
            "column": 1
          },
          "endPosition": {
            "line": 1,
            "column": 28
          }
        }
      }
    ]
  },
  "declarationCandidates": {
    "status": "exact",
    "value": []
  },
  "application": {
    "status": "exact",
    "value": {
      "kind": "@function",
      "callee": {
        "kind": "function",
        "canonical": "@app@0.1.0/app.main.choose"
      },
      "calleeType": {
        "kind": "function",
        "name": "fn",
        "parameters": [
          {
            "kind": "primitive",
            "name": "i32",
            "parameters": [],
            "result": null,
            "labelled": []
          }
        ],
        "result": {
          "kind": "primitive",
          "name": "i32",
          "parameters": [],
          "result": null,
          "labelled": []
        },
        "labelled": []
      },
      "positional": [
        {
          "kind": "primitive",
          "name": "i32",
          "parameters": [],
          "result": null,
          "labelled": []
        }
      ],
      "labelled": [],
      "resultType": {
        "kind": "primitive",
        "name": "i32",
        "parameters": [],
        "result": null,
        "labelled": []
      },
      "dispatch": null
    }
  },
  "pattern": {
    "status": "unavailable",
    "value": null
  }
}
