{
  "schemaVersion": 1,
  "workspaceRevision": "sha256:907ada83b5257fd4415831b9dc687fe48bd74847cb4ee3a5a2e53a8454458fab",
  "sourceId": "src/main.vib",
  "offset": 149,
  "nodeId": "src/main.vib#149-150",
  "structural": {
    "schemaVersion": 1,
    "offset": 149,
    "sourceId": "src/main.vib",
    "span": {
      "sourceId": "src/main.vib",
      "start": 149,
      "end": 150,
      "startPosition": {
        "line": 4,
        "column": 66
      },
      "endPosition": {
        "line": 4,
        "column": 67
      }
    },
    "mode": "source",
    "syntaxKind": "close-paren",
    "category": "expression",
    "status": "exact",
    "permittedForms": [
      "lambda",
      "do",
      "let",
      "let-else",
      "if",
      "match",
      "return",
      "as",
      "try"
    ],
    "permittedLabels": [
      "types"
    ]
  },
  "role": {
    "status": "exact",
    "value": "@unknown"
  },
  "context": {
    "status": "exact",
    "value": "function"
  },
  "identity": {
    "status": "unavailable",
    "value": null
  },
  "expectedType": {
    "status": "unavailable",
    "value": null
  },
  "observedType": {
    "status": "exact",
    "value": {
      "kind": "function",
      "name": "fn",
      "parameters": [
        {
          "kind": "primitive",
          "name": "i32",
          "parameters": [],
          "result": null,
          "labelled": []
        }
      ],
      "result": {
        "kind": "primitive",
        "name": "i32",
        "parameters": [],
        "result": null,
        "labelled": []
      },
      "labelled": []
    }
  },
  "visibleLocals": {
    "status": "exact",
    "value": [
      {
        "name": "base",
        "identity": "binder:src/main.vib:96-100"
      },
      {
        "name": "entries",
        "identity": "binder:src/main.vib:121-128"
      }
    ]
  },
  "visibleImports": {
    "status": "exact",
    "value": []
  },
  "declarationCandidates": {
    "status": "exact",
    "value": []
  },
  "application": {
    "status": "unavailable",
    "value": null
  },
  "pattern": {
    "status": "unavailable",
    "value": null
  }
}
