{
  "schemaVersion": 1,
  "workspaceRevision": "sha256:c778820a5500c1f8f68d2f94d65866debc333f96674b649c7af38bbb83a5a8ab",
  "sourceId": "src/main.vib",
  "offset": 312,
  "nodeId": "src/main.vib#312-313",
  "structural": {
    "schemaVersion": 1,
    "offset": 312,
    "sourceId": "src/main.vib",
    "span": {
      "sourceId": "src/main.vib",
      "start": 312,
      "end": 313,
      "startPosition": {
        "line": 13,
        "column": 52
      },
      "endPosition": {
        "line": 13,
        "column": 53
      }
    },
    "mode": "source",
    "syntaxKind": "open-paren",
    "category": "expression",
    "status": "exact",
    "permittedForms": [
      "lambda",
      "do",
      "let",
      "if",
      "match",
      "as",
      "try"
    ],
    "permittedLabels": [
      "types"
    ]
  },
  "role": {
    "status": "exact",
    "value": "@application"
  },
  "context": {
    "status": "exact",
    "value": "argument"
  },
  "identity": {
    "status": "unavailable",
    "value": null
  },
  "expectedType": {
    "status": "exact",
    "value": {
      "kind": "primitive",
      "name": "i32",
      "parameters": [],
      "result": null,
      "labelled": []
    }
  },
  "observedType": {
    "status": "exact",
    "value": {
      "kind": "primitive",
      "name": "i32",
      "parameters": [],
      "result": null,
      "labelled": []
    }
  },
  "visibleLocals": {
    "status": "exact",
    "value": [
      {
        "name": "value",
        "identity": "binder:src/main.vib:280-285"
      }
    ]
  },
  "visibleImports": {
    "status": "exact",
    "value": [
      {
        "alias": "from",
        "module": "@std.core",
        "sourceId": "src/main.vib",
        "span": {
          "sourceId": "src/main.vib",
          "start": 0,
          "end": 28,
          "startPosition": {
            "line": 1,
            "column": 1
          },
          "endPosition": {
            "line": 1,
            "column": 29
          }
        }
      }
    ]
  },
  "declarationCandidates": {
    "status": "exact",
    "value": []
  },
  "application": {
    "status": "exact",
    "value": {
      "kind": "@contract",
      "callee": null,
      "calleeType": null,
      "positional": [
        {
          "kind": "primitive",
          "name": "i16",
          "parameters": [],
          "result": null,
          "labelled": []
        }
      ],
      "labelled": [],
      "resultType": {
        "kind": "primitive",
        "name": "i32",
        "parameters": [],
        "result": null,
        "labelled": []
      },
      "dispatch": {
        "interface": "std.core.from",
        "member": "convert",
        "receiver": {
          "kind": "primitive",
          "name": "i32",
          "parameters": [],
          "result": null,
          "labelled": []
        },
        "selection": "closed",
        "destination": true
      }
    }
  },
  "pattern": {
    "status": "unavailable",
    "value": null
  }
}
