{
  "schemaVersion": 1,
  "workspaceRevision": "sha256:a49f233e2bf88e71c963b624771d99fa2506112c3b24e8203ea078d58a368437",
  "sourceId": "src/main.vib",
  "offset": 577,
  "nodeId": "src/main.vib#577-578",
  "structural": {
    "schemaVersion": 1,
    "offset": 577,
    "sourceId": "src/main.vib",
    "span": {
      "sourceId": "src/main.vib",
      "start": 577,
      "end": 578,
      "startPosition": {
        "line": 26,
        "column": 5
      },
      "endPosition": {
        "line": 26,
        "column": 6
      }
    },
    "mode": "source",
    "syntaxKind": "open-paren",
    "category": "pattern",
    "status": "exact",
    "permittedForms": [
      "tuple",
      "array",
      "as"
    ],
    "permittedLabels": []
  },
  "role": {
    "status": "exact",
    "value": "@unknown"
  },
  "context": {
    "status": "exact",
    "value": "result"
  },
  "identity": {
    "status": "unavailable",
    "value": null
  },
  "expectedType": {
    "status": "exact",
    "value": {
      "kind": "primitive",
      "name": "i32",
      "parameters": [],
      "result": null,
      "labelled": []
    }
  },
  "observedType": {
    "status": "exact",
    "value": {
      "kind": "primitive",
      "name": "i32",
      "parameters": [],
      "result": null,
      "labelled": []
    }
  },
  "visibleLocals": {
    "status": "exact",
    "value": [
      {
        "name": "value",
        "identity": "binder:src/main.vib:532-537"
      },
      {
        "name": "x",
        "identity": "binder:src/main.vib:600-601"
      }
    ]
  },
  "visibleImports": {
    "status": "exact",
    "value": [
      {
        "alias": "from",
        "module": "@std.core",
        "sourceId": "src/main.vib",
        "span": {
          "sourceId": "src/main.vib",
          "start": 0,
          "end": 28,
          "startPosition": {
            "line": 1,
            "column": 1
          },
          "endPosition": {
            "line": 1,
            "column": 29
          }
        }
      }
    ]
  },
  "declarationCandidates": {
    "status": "exact",
    "value": []
  },
  "application": {
    "status": "unavailable",
    "value": null
  },
  "pattern": {
    "status": "exact",
    "value": {
      "kind": "@variant",
      "scrutineeType": {
        "kind": "declared",
        "name": "std.option.option",
        "parameters": [
          {
            "kind": "declared",
            "name": "app.main.point",
            "parameters": [],
            "result": null,
            "labelled": []
          }
        ],
        "result": null,
        "labelled": []
      },
      "narrowed": null,
      "unionMembers": []
    }
  }
}
