{
  "schemaVersion": 1,
  "workspaceRevision": "sha256:e0db87daae0435d3ec5d68314b51bdc1483bbee9e24bf4e4784d89a4c8c762e1",
  "sourceId": "src/damaged.vib",
  "offset": 41,
  "nodeId": "src/damaged.vib#41-41",
  "structural": {
    "schemaVersion": 1,
    "offset": 41,
    "sourceId": "src/damaged.vib",
    "span": {
      "sourceId": "src/damaged.vib",
      "start": 41,
      "end": 41,
      "startPosition": {
        "line": 1,
        "column": 42
      },
      "endPosition": {
        "line": 1,
        "column": 42
      }
    },
    "mode": "source",
    "syntaxKind": "error",
    "category": "recovery",
    "status": "recovered",
    "permittedForms": null,
    "permittedLabels": null
  },
  "role": {
    "status": "recovered",
    "value": "@unknown"
  },
  "context": {
    "status": "recovered",
    "value": "recovery"
  },
  "identity": {
    "status": "unavailable",
    "value": null
  },
  "expectedType": {
    "status": "unavailable",
    "value": null
  },
  "observedType": {
    "status": "unavailable",
    "value": null
  },
  "visibleLocals": {
    "status": "unavailable",
    "value": null
  },
  "visibleImports": {
    "status": "unavailable",
    "value": null
  },
  "declarationCandidates": {
    "status": "unavailable",
    "value": null
  },
  "application": {
    "status": "unavailable",
    "value": null
  },
  "pattern": {
    "status": "unavailable",
    "value": null
  }
}
