{
  "schemaVersion": 1,
  "workspaceRevision": "sha256:21ce7d7881bf4edf948d5afab57c81c941eb1743e1b99b5026cd7b441de7f1e2",
  "sourceId": "src/main.vib",
  "offset": 134,
  "nodeId": "src/main.vib#134-140",
  "structural": {
    "schemaVersion": 1,
    "offset": 134,
    "sourceId": "src/main.vib",
    "span": {
      "sourceId": "src/main.vib",
      "start": 134,
      "end": 140,
      "startPosition": {
        "line": 5,
        "column": 47
      },
      "endPosition": {
        "line": 5,
        "column": 53
      }
    },
    "mode": "source",
    "syntaxKind": "atom",
    "category": "expression",
    "status": "exact",
    "permittedForms": [
      "lambda",
      "do",
      "if",
      "match",
      "return",
      "as",
      "try"
    ],
    "permittedLabels": [
      "types"
    ]
  },
  "role": {
    "status": "exact",
    "value": "@local-binding"
  },
  "context": {
    "status": "exact",
    "value": "return-operand"
  },
  "identity": {
    "status": "exact",
    "value": {
      "kind": "binder",
      "canonical": "binder:src/main.vib:74-80"
    }
  },
  "expectedType": {
    "status": "exact",
    "value": {
      "kind": "primitive",
      "name": "i32",
      "parameters": [],
      "result": null,
      "labelled": []
    }
  },
  "observedType": {
    "status": "exact",
    "value": {
      "kind": "primitive",
      "name": "i32",
      "parameters": [],
      "result": null,
      "labelled": []
    }
  },
  "visibleLocals": {
    "status": "exact",
    "value": [
      {
        "name": "flag",
        "identity": "binder:src/main.vib:14-18"
      },
      {
        "name": "value",
        "identity": "binder:src/main.vib:24-29"
      },
      {
        "name": "first",
        "identity": "binder:src/main.vib:59-64"
      },
      {
        "name": "second",
        "identity": "binder:src/main.vib:74-80"
      }
    ]
  },
  "visibleImports": {
    "status": "exact",
    "value": []
  },
  "declarationCandidates": {
    "status": "exact",
    "value": []
  },
  "application": {
    "status": "unavailable",
    "value": null
  },
  "pattern": {
    "status": "unavailable",
    "value": null
  }
}
