{
  "schemaVersion": 1,
  "workspaceRevision": "sha256:bda7f9211350c153be31af666d8dc6a2db61f9b53fed164242e54b2264148378",
  "sourceId": "src/main.vib",
  "offset": 92,
  "nodeId": "src/main.vib#92-96",
  "structural": {
    "schemaVersion": 1,
    "offset": 92,
    "sourceId": "src/main.vib",
    "span": {
      "sourceId": "src/main.vib",
      "start": 92,
      "end": 96,
      "startPosition": {
        "line": 3,
        "column": 29
      },
      "endPosition": {
        "line": 3,
        "column": 33
      }
    },
    "mode": "source",
    "syntaxKind": "atom",
    "category": "expression",
    "status": "exact",
    "permittedForms": [
      "lambda",
      "do",
      "let",
      "if",
      "match",
      "as",
      "try"
    ],
    "permittedLabels": [
      "types"
    ]
  },
  "role": {
    "status": "exact",
    "value": "@literal"
  },
  "context": {
    "status": "exact",
    "value": "argument"
  },
  "identity": {
    "status": "unavailable",
    "value": null
  },
  "expectedType": {
    "status": "exact",
    "value": {
      "kind": "primitive",
      "name": "i32",
      "parameters": [],
      "result": null,
      "labelled": []
    }
  },
  "observedType": {
    "status": "exact",
    "value": {
      "kind": "primitive",
      "name": "i32",
      "parameters": [],
      "result": null,
      "labelled": []
    }
  },
  "visibleLocals": {
    "status": "exact",
    "value": []
  },
  "visibleImports": {
    "status": "exact",
    "value": [
      {
        "alias": "helper",
        "module": "@app.helper",
        "sourceId": "src/main.vib",
        "span": {
          "sourceId": "src/main.vib",
          "start": 0,
          "end": 27,
          "startPosition": {
            "line": 1,
            "column": 1
          },
          "endPosition": {
            "line": 1,
            "column": 28
          }
        }
      }
    ]
  },
  "declarationCandidates": {
    "status": "exact",
    "value": []
  },
  "application": {
    "status": "unavailable",
    "value": null
  },
  "pattern": {
    "status": "unavailable",
    "value": null
  }
}
